number,value,datetime_start,datetime_complete,duration,params_augment.mask_ratio,params_augment.token_latent_views,params_loss.cov_iso_lambda,params_loss.ibot_head,params_loss.ibot_lambda,params_loss.ibot_use_token_center,params_loss.teacher_temp,params_train.head_lr,params_train.lr,params_train.momentum_end,state
0,,2026-09-19 06:49:30.676579,2026-09-19 06:55:10.711472,0 days 00:05:40.034893,0.18952393376076843,2,2.9510340757720805,separate,0.9077666974314438,True,0.1554830757563675,0.0011992239102652101,4.685744561805481e-05,0.9988088441681271,FAIL
1,0.622,2026-09-19 06:53:43.690196,2026-09-19 06:59:50.930828,0 days 00:06:07.240632,0.3319354540894748,2,0.8215970710788025,shared,0.07041339539542249,False,0.09956224761769285,0.0007476357719207517,0.00019149691755810988,0.9993159845772526,COMPLETE
2,0.7146,2026-09-19 06:59:50.983146,2026-09-19 07:25:20.927407,0 days 00:25:29.944261,0.09850231159778008,2,1.2908995196638886,shared,0.02611743602801874,True,0.1620545275882448,0.0001906461896994359,0.0001296394523973671,0.9980073029893132,COMPLETE
3,0.6782,2026-09-19 07:25:20.977135,2026-09-19 07:43:59.825665,0 days 00:18:38.848530,0.3345511209236958,2,3.8289180282866555,shared,0.03540663318478604,True,0.09922525978842077,0.00170211625790097,8.162559751994168e-05,0.9991309999323469,COMPLETE
4,0.7008,2026-09-19 07:43:59.860860,2026-09-19 08:09:32.250101,0 days 00:25:32.389241,0.3183085664321187,1,0.9187311346673928,shared,0.2578567296825846,False,0.13831463623992044,0.0017378451549309388,0.00016516055406318433,0.9993595949873906,COMPLETE
5,0.7362,2026-09-19 08:09:32.286750,2026-09-19 08:35:02.912402,0 days 00:25:30.625652,0.2407834645016501,2,1.2946655315697082,shared,0.09337837273761068,True,0.15915202478163984,0.0009522701999321792,9.046326290924225e-05,0.9991647516341424,COMPLETE
6,0.6526,2026-09-19 08:35:02.956714,2026-09-19 09:00:37.137758,0 days 00:25:34.181044,0.15500518634058086,2,0.4496695957442514,separate,0.1769186398033362,True,0.10521788652597022,0.00042103088982937866,2.4069894227540258e-05,0.9989770855586289,COMPLETE
7,0.6969,2026-09-19 09:00:37.164884,2026-09-19 09:25:18.545862,0 days 00:24:41.380978,0.11144331612359275,2,0.8109278813950337,separate,0.005847807807886955,True,0.15945247079348596,0.000668570769409138,0.0002088308286141864,0.9989003187938843,COMPLETE
8,0.6363,2026-09-19 09:25:18.580650,2026-09-19 09:31:25.602202,0 days 00:06:07.021552,0.1619181938168893,2,0.40258409023827546,separate,0.009349217947708993,False,0.09812447446797265,0.0005612478786410102,8.787153690498615e-05,0.9981527981145896,COMPLETE
9,0.7207,2026-09-19 09:31:25.639331,2026-09-19 09:56:09.918458,0 days 00:24:44.279127,0.25430283493445666,2,1.2649274780866853,shared,0.2147861417715644,True,0.15018986864424472,0.0012108046597443121,3.5995352457129776e-05,0.9985816730606331,COMPLETE
10,0.6788,2026-09-19 09:56:09.954077,2026-09-19 10:20:03.458208,0 days 00:23:53.504131,0.12646197031829096,2,0.5866877729393971,shared,0.005749067531588009,False,0.17884430879151608,0.0004958621684564111,0.00019576220144777398,0.9986771358620614,COMPLETE
11,0.7108,2026-09-19 10:20:03.495459,2026-09-19 10:43:44.196987,0 days 00:23:40.701528,0.23283900591483053,1,7.151085910747505,separate,1.0733762101492679,True,0.12534855892133412,0.0002734496115442434,5.018869744688698e-05,0.9983229996077031,COMPLETE
12,0.7256,2026-09-19 10:43:44.236363,2026-09-19 11:07:24.825352,0 days 00:23:40.588989,0.24466009305259662,1,1.9285923389633286,shared,0.30860570692320205,True,0.14585592034063832,0.0011030408791662665,3.299165918794236e-05,0.9985812075067256,COMPLETE
13,0.7217,2026-09-19 11:07:24.854760,2026-09-19 11:31:19.352371,0 days 00:23:54.497611,0.23541701221781194,1,2.4256485135895955,shared,0.6788267858743633,True,0.1309924449253702,0.0010240404416102925,5.374201692700051e-05,0.9985570918383944,COMPLETE
14,0.6694,2026-09-19 11:31:19.379591,2026-09-19 11:55:06.675373,0 days 00:23:47.295782,0.27877477715491417,1,2.3480365800513985,shared,0.08716947106140491,True,0.1795371502500609,0.0010086407383522495,2.3535593682015814e-05,0.999464518276324,COMPLETE
15,0.7295,2026-09-19 11:55:06.710489,2026-09-19 12:18:33.449061,0 days 00:23:26.738572,0.1952417013925337,1,2.0238897758372376,shared,0.27103850156973186,True,0.14817676239465336,0.0012394481987104953,9.131436388434347e-05,0.9988069561695556,COMPLETE
16,0.6679,2026-09-19 12:18:33.484210,2026-09-19 12:41:36.689297,0 days 00:23:03.205087,0.05419549752873368,1,4.362657073320528,shared,0.4725575240281982,True,0.16504024503629208,0.0008023214787682041,9.905886990589619e-05,0.9989121443253296,COMPLETE
17,0.71,2026-09-19 12:41:36.729115,2026-09-19 13:05:21.249878,0 days 00:23:44.520763,0.2061262407285295,1,1.5102377292920122,shared,0.07744564349250968,True,0.12409749886828346,0.0013606310850847586,6.50049943693641e-05,0.9991765495910168,COMPLETE
18,0.6961,2026-09-19 13:05:21.278251,2026-09-19 13:27:37.818445,0 days 00:22:16.540194,0.18595872310206457,1,3.229964778956809,shared,0.11757223307444337,True,0.15141030142508216,0.0008660663447651474,0.00011918265857688858,0.9987628018186367,COMPLETE
19,0.7153,2026-09-19 13:27:37.853921,2026-09-19 13:51:07.526645,0 days 00:23:29.672724,0.2822662020462059,2,5.879793645472747,separate,0.030843180703651763,False,0.11579100274475462,0.0013761456533901647,0.00012987516107373936,0.99910638607786,COMPLETE
20,0.7183,2026-09-19 13:51:07.561663,2026-09-19 14:14:25.684245,0 days 00:23:18.122582,0.1957792439111098,1,1.7997240615501384,shared,1.3359485791163541,True,0.16866555900439933,0.00035905693907760334,7.11712591828035e-05,0.9983517381458374,COMPLETE
21,0.7045,2026-09-19 14:14:25.723404,2026-09-19 14:37:43.921190,0 days 00:23:18.197786,0.2914927151190872,1,1.0392205228691178,shared,0.4976353156469955,True,0.14001895091648858,0.0009153376659705545,0.0001056492464760145,0.9992515390708615,COMPLETE
22,0.7228,2026-09-19 14:37:43.951160,2026-09-19 15:00:56.089830,0 days 00:23:12.138670,0.23187435017057115,1,2.093485938964396,shared,0.32753409791450244,True,0.14894920596670103,0.0012081145186981703,3.525413765971396e-05,0.9984637564815638,COMPLETE
23,0.7253,2026-09-19 15:00:56.126485,2026-09-19 15:24:15.696964,0 days 00:23:19.570479,0.25935399689476774,1,2.837349950703819,shared,0.14243805439534177,True,0.1456578238468007,0.0006467721422926008,4.487144675888498e-05,0.9988106860459848,COMPLETE
24,0.7207,2026-09-19 15:24:15.736337,2026-09-19 15:47:51.567452,0 days 00:23:35.831115,0.21455674911606984,1,1.6452605135795113,shared,0.052792800486697065,True,0.1570505297238803,0.0011039457881807798,3.118797208107005e-05,0.9990173506442527,COMPLETE
25,0.7376,2026-09-19 15:47:51.605720,2026-09-19 16:11:11.912408,0 days 00:23:20.306688,0.16918254205541944,1,1.149745205393667,shared,0.3335535901844174,True,0.17174709631326548,0.0013833380185675447,6.155003379929101e-05,0.9986927158900474,COMPLETE
26,0.7272,2026-09-19 16:11:11.960708,2026-09-19 16:35:44.976783,0 days 00:24:33.016075,0.16927371109937356,1,0.6839551997154013,shared,0.5796337791316166,True,0.16852995314683397,0.0014915357250706192,6.0632346546242554e-05,0.9987305298369653,COMPLETE
27,0.7302,2026-09-19 16:35:45.015923,2026-09-19 16:59:41.948270,0 days 00:23:56.932347,0.14799603561637822,2,1.162651252418895,separate,0.12795658103748733,False,0.17306857204747303,0.0014794078814394749,7.740580577239241e-05,0.9988490278155013,COMPLETE
28,0.7371,2026-09-19 16:59:41.985311,2026-09-19 17:24:01.409314,0 days 00:24:19.424003,0.13524995360269845,2,1.1298821791615494,separate,0.01585138101113525,False,0.1723574165934972,0.0015168169350902472,7.627687218247479e-05,0.9990350770543781,COMPLETE
29,0.7223,2026-09-19 17:24:01.443700,2026-09-19 17:49:00.711103,0 days 00:24:59.267403,0.07363088250717637,2,0.5229064796219274,separate,0.01559754247326751,False,0.1723476585826877,0.0017339967408076422,4.4210749240719466e-05,0.9994439039678421,COMPLETE
30,0.6323,2026-09-19 17:49:00.745532,2026-09-19 17:55:19.716681,0 days 00:06:18.971149,0.13490543667375862,2,0.30739082681015195,separate,0.016058998456668097,False,0.09022042700695394,0.0007697308824817898,0.00015460988947306359,0.9993040784972614,COMPLETE
31,0.7318,2026-09-19 17:55:19.755609,2026-09-19 18:21:06.546172,0 days 00:25:46.790563,0.10190589954382759,2,0.7519727731810206,separate,0.049683950558526126,False,0.1565665486593003,0.0009331444878950915,5.966572778038323e-05,0.9990234509627329,COMPLETE
32,0.738,2026-09-19 18:21:06.581758,2026-09-19 18:46:27.281359,0 days 00:25:20.699601,0.09854516318477853,2,0.7790560894642756,separate,0.04678512363223404,False,0.15579668874283673,0.0009269539539604442,6.0924434770978586e-05,0.9990186591120274,COMPLETE
33,0.7361,2026-09-19 18:46:27.335745,2026-09-19 19:12:09.279241,0 days 00:25:41.943496,0.07699620467720239,2,0.9953072434191289,separate,0.018743891241849928,False,0.16336936946836406,0.0007004997205441373,7.16969718517547e-05,0.9992069702824107,COMPLETE
34,0.7241,2026-09-19 19:12:09.319206,2026-09-19 19:37:54.213617,0 days 00:25:44.894411,0.12164026230157302,2,1.4580521530008455,separate,0.041210287715067996,False,0.1734070423430995,0.0013925913797903666,5.0721689348749617e-05,0.9990638067293488,COMPLETE
35,0.7367,2026-09-19 19:37:54.251341,2026-09-19 20:03:20.059180,0 days 00:25:25.807839,0.08618014885155732,2,0.9034222923144611,separate,0.020851545829566127,False,0.15644635768099927,0.0015349990415420554,8.04142311688452e-05,0.9993511595079952,COMPLETE
36,0.7335,2026-09-19 20:03:20.093421,2026-09-19 20:28:46.356762,0 days 00:25:26.263341,0.07931541875245941,2,0.6242007542572058,separate,0.00990495472302006,False,0.16510525407944487,0.0014891004556025946,7.754121115615897e-05,0.9993513787903908,COMPLETE
37,0.7425,2026-09-19 20:28:46.388120,2026-09-19 20:54:15.695331,0 days 00:25:29.307211,0.0893922014811703,2,0.8799655251148008,separate,0.02268132258842827,False,0.15348259183438787,0.0015970544124081498,6.835155655084577e-05,0.9989358103712944,COMPLETE
38,0.7201,2026-09-19 20:54:15.753948,2026-09-19 21:19:48.450284,0 days 00:25:32.696336,0.14575204822488452,2,0.8024926984688447,separate,0.010700837164104733,False,0.1401144538414253,0.00019580143474702574,4.268066932264063e-05,0.9989126632845495,COMPLETE
39,0.7472,2026-09-19 21:19:48.489003,2026-09-19 21:44:59.027072,0 days 00:25:10.538069,0.10433451353135939,2,1.1547668492315473,separate,0.02588004326528407,False,0.169402438717914,0.0017378849545595832,5.6498061638703886e-05,0.9986640653736109,COMPLETE
40,0.7216,2026-09-19 21:44:59.075188,2026-09-19 22:10:10.305240,0 days 00:25:11.230052,0.051903913766622366,2,0.4737185122875944,separate,0.024534574972014098,False,0.15475951006273622,0.0016926580840746519,5.714900605393746e-05,0.9987077527254038,COMPLETE
41,0.7436,2026-09-19 22:10:10.338284,2026-09-19 22:35:01.305995,0 days 00:24:50.967711,0.09917358216848014,2,1.3429345420818812,separate,0.05863323470211268,False,0.16785470786772522,0.001230702034224456,6.873087977114966e-05,0.9986467564692334,COMPLETE
42,0.7529,2026-09-19 22:35:01.338058,2026-09-19 22:59:24.763830,0 days 00:24:23.425772,0.10455775557768308,2,1.422149535786728,separate,0.032304419727248075,False,0.159686588619852,0.0012497023269489233,6.48261571396343e-05,0.9986697009541693,COMPLETE
43,0.7357,2026-09-19 22:59:24.820410,2026-09-19 23:23:34.623470,0 days 00:24:09.803060,0.1047252930942663,2,1.4030514509133845,separate,0.05477406616677643,False,0.1615827773636012,0.0010971262389063024,6.580954669568767e-05,0.998503908933522,COMPLETE
44,0.7435,2026-09-19 23:23:34.662366,2026-09-19 23:47:46.776816,0 days 00:24:12.114450,0.09354284856134545,2,0.9012966149513569,separate,0.03787471834988715,False,0.15356616089813555,0.0012211043018801654,4.766221405243208e-05,0.9986449204186321,COMPLETE
45,0.7395,2026-09-19 23:47:46.809432,2026-09-20 00:12:01.155193,0 days 00:24:14.345761,0.11637870757849905,2,0.9115027064213785,separate,0.02944629344338343,False,0.16077793090268602,0.0012463447951333254,4.839283641624177e-05,0.9986265669495673,COMPLETE
46,0.7344,2026-09-20 00:12:01.196842,2026-09-20 00:36:13.220755,0 days 00:24:12.023913,0.085168663134769,2,1.3647389843353743,separate,0.06493712532100794,False,0.1431931785783673,0.0016503864030770457,3.9686944375653876e-05,0.9983895196365152,COMPLETE
47,0.7219,2026-09-20 00:36:13.260089,2026-09-20 01:00:26.815876,0 days 00:24:13.555787,0.3499105457455815,2,1.656233337209059,separate,0.03554513360632459,False,0.15192674865368933,0.0012378477460650579,5.4853585786318356e-05,0.998645209297687,COMPLETE
48,0.73,2026-09-20 01:00:26.845328,2026-09-20 01:25:01.895465,0 days 00:24:35.050137,0.059157124903579154,2,1.2255103837243373,separate,0.024055189386703032,False,0.1675538284599241,0.0011061979995980959,7.098160851613289e-05,0.9982014125976958,COMPLETE
49,0.7214,2026-09-20 01:25:01.931800,2026-09-20 01:50:03.025457,0 days 00:25:01.093657,0.06860061729394602,2,0.9857240622225028,separate,0.06638146923272961,False,0.17676161010939,0.0012878529182791772,9.160570220514841e-05,0.9984624974319053,COMPLETE
50,0.7177,2026-09-20 01:50:03.052939,2026-09-20 02:14:40.961340,0 days 00:24:37.908401,0.09203215600454032,2,0.6968064273235679,separate,0.03517867852314815,False,0.1318659787703557,0.0016141616272353284,5.1171962345171496e-05,0.9986267608226963,COMPLETE
